Time,Source,Destination,Protocol,Length,Info
Ether / ARP who has 192.168.1.35 says 192.168.1.1 / Padding --> Unknown Traffic
Ether / ARP who has 192.168.1.43 says 192.168.1.1 / Padding --> Unknown Traffic
Ether / ARP is at 30:03:c8:8a:94:35 says 192.168.1.43 --> Unknown Traffic
Ether / ARP who has 192.168.1.34 says 192.168.1.1 / Padding --> Unknown Traffic
Ether / ARP who has 192.168.1.41 says 192.168.1.1 / Padding --> Unknown Traffic
Ether / IP / TCP 192.168.1.43:59420 > 3.233.158.24:https A --> Web Traffic
Ether / IP / TCP 3.233.158.24:https > 192.168.1.43:59420 A --> Other TCP Traffic
Ether / ARP who has 192.168.1.35 says 192.168.1.1 / Padding --> Unknown Traffic
Ether / ARP who has 192.168.1.43 says 192.168.1.1 / Padding --> Unknown Traffic
Ether / ARP is at 30:03:c8:8a:94:35 says 192.168.1.43 --> Unknown Traffic
Ether / ARP who has 192.168.1.34 says 192.168.1.1 / Padding --> Unknown Traffic
Ether / ARP who has 192.168.1.41 says 192.168.1.1 / Padding --> Unknown Traffic
Ether / ARP who has 192.168.1.35 says 192.168.1.1 / Padding --> Unknown Traffic
Ether / ARP who has 192.168.1.43 says 192.168.1.1 / Padding --> Unknown Traffic
Ether / ARP is at 30:03:c8:8a:94:35 says 192.168.1.43 --> Unknown Traffic
Ether / ARP who has 192.168.1.34 says 192.168.1.1 / Padding --> Unknown Traffic
Ether / ARP who has 192.168.1.41 says 192.168.1.1 / Padding --> Unknown Traffic
Ether / ARP who has 192.168.1.36 says 192.168.1.1 / Padding --> Unknown Traffic
Ether / IP / TCP 192.168.1.43:60354 > 74.125.68.188:5228 A --> Other TCP Traffic
Ether / IP / TCP 74.125.68.188:5228 > 192.168.1.43:60354 A --> Other TCP Traffic
Ether / ARP who has 192.168.1.35 says 192.168.1.1 / Padding --> Unknown Traffic
Ether / ARP who has 192.168.1.43 says 192.168.1.1 / Padding --> Unknown Traffic
Ether / ARP is at 30:03:c8:8a:94:35 says 192.168.1.43 --> Unknown Traffic
Ether / ARP who has 192.168.1.34 says 192.168.1.1 / Padding --> Unknown Traffic
Ether / ARP who has 192.168.1.41 says 192.168.1.1 / Padding --> Unknown Traffic
Ether / ARP who has 192.168.1.36 says 192.168.1.1 / Padding --> Unknown Traffic
Ether / ARP who has 192.168.1.35 says 192.168.1.1 / Padding --> Unknown Traffic
Ether / ARP who has 192.168.1.43 says 192.168.1.1 / Padding --> Unknown Traffic
Ether / ARP is at 30:03:c8:8a:94:35 says 192.168.1.43 --> Unknown Traffic
Ether / ARP who has 192.168.1.34 says 192.168.1.1 / Padding --> Unknown Traffic
Ether / ARP who has 192.168.1.41 says 192.168.1.1 / Padding --> Unknown Traffic
Ether / ARP who has 192.168.1.36 says 192.168.1.1 / Padding --> Unknown Traffic
Ether / IP / TCP 192.168.1.43:50482 > 20.42.73.26:https PA / Raw --> Web Traffic
Ether / IP / TCP 192.168.1.43:50482 > 20.42.73.26:https A / Raw --> Web Traffic
Ether / IP / TCP 192.168.1.43:50482 > 20.42.73.26:https PA / Raw --> Web Traffic
Ether / IP / TCP 192.168.1.43:50482 > 20.42.73.26:https A / Raw --> Web Traffic
Ether / IP / TCP 192.168.1.43:50482 > 20.42.73.26:https PA / Raw --> Web Traffic
Ether / IP / TCP 192.168.1.43:50482 > 20.42.73.26:https A / Raw --> Web Traffic
Ether / IP / TCP 192.168.1.43:50482 > 20.42.73.26:https PA / Raw --> Web Traffic
Ether / IP / TCP 192.168.1.43:50482 > 20.42.73.26:https A / Raw --> Web Traffic
Ether / IP / TCP 192.168.1.43:50482 > 20.42.73.26:https PA / Raw --> Web Traffic
Ether / IP / TCP 192.168.1.43:50482 > 20.42.73.26:https A / Raw --> Web Traffic
Ether / IP / TCP 20.42.73.26:https > 192.168.1.43:50482 A --> Other TCP Traffic
Ether / IP / TCP 192.168.1.43:50482 > 20.42.73.26:https A / Raw --> Web Traffic
Ether / IP / TCP 192.168.1.43:50482 > 20.42.73.26:https PA / Raw --> Web Traffic
Ether / IP / TCP 20.42.73.26:https > 192.168.1.43:50482 A --> Other TCP Traffic
Ether / IP / TCP 20.42.73.26:https > 192.168.1.43:50482 A --> Other TCP Traffic
Ether / IP / TCP 20.42.73.26:https > 192.168.1.43:50482 A --> Other TCP Traffic
Ether / IP / TCP 20.42.73.26:https > 192.168.1.43:50482 A --> Other TCP Traffic
Ether / IP / TCP 192.168.1.43:50482 > 20.42.73.26:https PA / Raw --> Web Traffic
Ether / IP / TCP 20.42.73.26:https > 192.168.1.43:50482 PA / Raw --> Other TCP Traffic
Ether / IP / TCP 192.168.1.43:50482 > 20.42.73.26:https A --> Web Traffic
Ether / IP / TCP 20.42.73.26:https > 192.168.1.43:50482 A --> Other TCP Traffic
Ether / IP / TCP 20.42.73.26:https > 192.168.1.43:50482 PA / Raw --> Other TCP Traffic
Ether / IP / TCP 192.168.1.43:50482 > 20.42.73.26:https A --> Web Traffic
Ether / IP / TCP 192.168.1.43:50482 > 20.42.73.26:https PA / Raw --> Web Traffic
Ether / IP / TCP 20.42.73.26:https > 192.168.1.43:50482 A --> Other TCP Traffic
Ether / ARP who has 192.168.1.35 says 192.168.1.1 / Padding --> Unknown Traffic
Ether / ARP who has 192.168.1.43 says 192.168.1.1 / Padding --> Unknown Traffic
Ether / ARP is at 30:03:c8:8a:94:35 says 192.168.1.43 --> Unknown Traffic
Ether / ARP who has 192.168.1.34 says 192.168.1.1 / Padding --> Unknown Traffic
Ether / ARP who has 192.168.1.41 says 192.168.1.1 / Padding --> Unknown Traffic
Ether / ARP who has 192.168.1.36 says 192.168.1.1 / Padding --> Unknown Traffic
Ether / IP / TCP 192.168.1.43:50482 > 20.42.73.26:https PA / Raw --> Web Traffic
Ether / IP / TCP 192.168.1.43:50482 > 20.42.73.26:https A / Raw --> Web Traffic
Ether / IP / TCP 192.168.1.43:50482 > 20.42.73.26:https PA / Raw --> Web Traffic
Ether / IP / TCP 192.168.1.43:50482 > 20.42.73.26:https A / Raw --> Web Traffic
Ether / IP / TCP 192.168.1.43:50482 > 20.42.73.26:https PA / Raw --> Web Traffic
Ether / IP / TCP 192.168.1.43:50482 > 20.42.73.26:https A / Raw --> Web Traffic
Ether / IP / TCP 192.168.1.43:50482 > 20.42.73.26:https PA / Raw --> Web Traffic
Ether / IP / TCP 192.168.1.43:50482 > 20.42.73.26:https A / Raw --> Web Traffic
Ether / IP / TCP 192.168.1.43:50482 > 20.42.73.26:https PA / Raw --> Web Traffic
Ether / IP / TCP 20.42.73.26:https > 192.168.1.43:50482 A --> Other TCP Traffic
Ether / IP / TCP 20.42.73.26:https > 192.168.1.43:50482 A --> Other TCP Traffic
Ether / IP / TCP 20.42.73.26:https > 192.168.1.43:50482 A --> Other TCP Traffic
Ether / IP / TCP 20.42.73.26:https > 192.168.1.43:50482 A --> Other TCP Traffic
Ether / IP / TCP 20.42.73.26:https > 192.168.1.43:50482 PA / Raw --> Other TCP Traffic
Ether / IP / TCP 192.168.1.43:50482 > 20.42.73.26:https A --> Web Traffic
Ether / IP / TCP 3.233.158.24:https > 192.168.1.43:59420 PA / Raw --> Other TCP Traffic
Ether / IP / TCP 192.168.1.43:59420 > 3.233.158.24:https FA --> Web Traffic
Ether / IP / TCP 3.233.158.24:https > 192.168.1.43:59420 PA / Raw --> Other TCP Traffic
Ether / IP / TCP 192.168.1.43:59420 > 3.233.158.24:https R --> Web Traffic
Ether / IP / TCP 3.233.158.24:https > 192.168.1.43:59420 FA --> Other TCP Traffic
Ether / IP / TCP 192.168.1.43:59420 > 3.233.158.24:https R --> Web Traffic
Ether / IP / UDP / DNS Qry b'api.snapcraft.io.' --> DNS Traffic
Ether / IP / UDP / DNS Qry b'api.snapcraft.io.' --> DNS Traffic
Ether / IP / UDP / DNS Ans 185.125.188.54 --> Other UDP Traffic
Ether / IP / UDP / DNS Ans 2620:2d:4000:1010::2e6 --> Other UDP Traffic
Ether / IP / TCP 192.168.1.43:35364 > 185.125.188.54:https S --> Web Traffic
Ether / IP / TCP 192.168.1.43:49196 > 34.233.228.199:https A --> Web Traffic
Ether / IP / TCP 192.168.1.43:56312 > 185.125.188.58:https S --> Web Traffic
Ether / IP / TCP 185.125.188.54:https > 192.168.1.43:35364 SA --> Other TCP Traffic
Ether / IP / TCP 192.168.1.43:35364 > 185.125.188.54:https A --> Web Traffic
Ether / IP / TCP 192.168.1.43:35364 > 185.125.188.54:https PA / Raw --> Web Traffic
Ether / IP / TCP 192.168.1.43:50482 > 20.42.73.26:https PA / Raw --> Web Traffic
Ether / IP / TCP 192.168.1.43:50482 > 20.42.73.26:https A / Raw --> Web Traffic
Ether / IP / TCP 192.168.1.43:50482 > 20.42.73.26:https PA / Raw --> Web Traffic
Ether / IP / TCP 192.168.1.43:50482 > 20.42.73.26:https A / Raw --> Web Traffic
Ether / IP / TCP 192.168.1.43:50482 > 20.42.73.26:https PA / Raw --> Web Traffic
Ether / IP / TCP 34.233.228.199:https > 192.168.1.43:49196 A --> Other TCP Traffic
Ether / IP / TCP 192.168.1.43:50482 > 20.42.73.26:https A / Raw --> Web Traffic
Ether / IP / TCP 192.168.1.43:50482 > 20.42.73.26:https PA / Raw --> Web Traffic
Ether / IP / TCP 192.168.1.43:50482 > 20.42.73.26:https A / Raw --> Web Traffic
Ether / IP / TCP 192.168.1.43:50482 > 20.42.73.26:https PA / Raw --> Web Traffic
Ether / IP / UDP 192.168.1.43:36976 > 239.255.255.250:1900 / Raw --> Other UDP Traffic
Ether / 192.168.1.43 > 224.0.0.22 igmp / Raw --> Unknown Traffic
Ether / IP / TCP 185.125.188.58:https > 192.168.1.43:56312 SA --> Other TCP Traffic
Ether / IP / TCP 192.168.1.43:56312 > 185.125.188.58:https A --> Web Traffic
Ether / IP / TCP 185.125.188.54:https > 192.168.1.43:35364 PA / Raw --> Other TCP Traffic
Ether / IP / TCP 192.168.1.43:35364 > 185.125.188.54:https A --> Web Traffic
Ether / IP / TCP 185.125.188.54:https > 192.168.1.43:35364 PA / Raw --> Other TCP Traffic
Ether / IP / TCP 192.168.1.43:35364 > 185.125.188.54:https A --> Web Traffic
Ether / IP / TCP 192.168.1.43:56312 > 185.125.188.58:https PA / Raw --> Web Traffic
Ether / IP / TCP 192.168.1.43:35364 > 185.125.188.54:https PA / Raw --> Web Traffic
Ether / IP / TCP 192.168.1.43:35364 > 185.125.188.54:https PA / Raw --> Web Traffic
Ether / IP / TCP 192.168.1.43:35364 > 185.125.188.54:https PA / Raw --> Web Traffic
Ether / 192.168.1.43 > 224.0.0.22 igmp / Raw --> Unknown Traffic
Ether / IP / TCP 20.42.73.26:https > 192.168.1.43:50482 A --> Other TCP Traffic
Ether / IP / TCP 20.42.73.26:https > 192.168.1.43:50482 A --> Other TCP Traffic
Ether / IP / TCP 20.42.73.26:https > 192.168.1.43:50482 A --> Other TCP Traffic
Ether / IP / TCP 20.42.73.26:https > 192.168.1.43:50482 A --> Other TCP Traffic
Ether / IP / TCP 20.42.73.26:https > 192.168.1.43:50482 PA / Raw --> Other TCP Traffic
Ether / IP / TCP 192.168.1.43:50482 > 20.42.73.26:https A --> Web Traffic
Ether / IP / UDP 192.168.1.43:47972 > 172.217.174.67:https / Raw --> Other UDP Traffic
Ether / IP / UDP 192.168.1.43:47972 > 172.217.174.67:https / Raw --> Other UDP Traffic
Ether / IP / UDP 172.217.174.67:https > 192.168.1.43:47972 / Raw --> Other UDP Traffic
Ether / IP / UDP 172.217.174.67:https > 192.168.1.43:47972 / Raw --> Other UDP Traffic
Ether / IP / UDP 172.217.174.67:https > 192.168.1.43:47972 / Raw --> Other UDP Traffic
Ether / IP / UDP 172.217.174.67:https > 192.168.1.43:47972 / Raw --> Other UDP Traffic
Ether / IP / UDP 192.168.1.43:47972 > 172.217.174.67:https / Raw --> Other UDP Traffic
Ether / IP / TCP 185.125.188.54:https > 192.168.1.43:35364 A --> Other TCP Traffic
Ether / IP / TCP 185.125.188.54:https > 192.168.1.43:35364 PA / Raw --> Other TCP Traffic
Ether / IP / TCP 185.125.188.54:https > 192.168.1.43:35364 PA / Raw --> Other TCP Traffic
Ether / IP / TCP 185.125.188.58:https > 192.168.1.43:56312 PA / Raw --> Other TCP Traffic
Ether / IP / TCP 192.168.1.43:56312 > 185.125.188.58:https A --> Web Traffic
Ether / IP / TCP 185.125.188.58:https > 192.168.1.43:56312 PA / Raw --> Other TCP Traffic
Ether / IP / TCP 192.168.1.43:56312 > 185.125.188.58:https A --> Web Traffic
Ether / IP / TCP 192.168.1.43:35364 > 185.125.188.54:https A --> Web Traffic
Ether / IP / TCP 192.168.1.43:56312 > 185.125.188.58:https PA / Raw --> Web Traffic
Ether / IP / TCP 185.125.188.54:https > 192.168.1.43:35364 PA / Raw --> Other TCP Traffic
Ether / IP / TCP 192.168.1.43:35364 > 185.125.188.54:https A --> Web Traffic
Ether / IP / TCP 185.125.188.54:https > 192.168.1.43:35364 PA / Raw --> Other TCP Traffic
Ether / IP / TCP 192.168.1.43:35364 > 185.125.188.54:https A --> Web Traffic
Ether / IP / TCP 185.125.188.54:https > 192.168.1.43:35364 PA / Raw --> Other TCP Traffic
Ether / IP / TCP 192.168.1.43:35364 > 185.125.188.54:https A --> Web Traffic
Ether / IP / TCP 185.125.188.54:https > 192.168.1.43:35364 PA / Raw --> Other TCP Traffic
Ether / IP / TCP 192.168.1.43:35364 > 185.125.188.54:https A --> Web Traffic
Ether / IP / TCP 185.125.188.54:https > 192.168.1.43:35364 A / Raw --> Other TCP Traffic
Ether / IP / TCP 192.168.1.43:35364 > 185.125.188.54:https A --> Web Traffic
Ether / IP / UDP 192.168.1.43:47972 > 172.217.174.67:https / Raw --> Other UDP Traffic
Ether / IP / UDP 192.168.1.43:47972 > 172.217.174.67:https / Raw --> Other UDP Traffic
Ether / IP / UDP 172.217.174.67:https > 192.168.1.43:47972 / Raw --> Other UDP Traffic
Ether / IP / UDP 172.217.174.67:https > 192.168.1.43:47972 / Raw --> Other UDP Traffic
Ether / IP / TCP 20.42.73.26:https > 192.168.1.43:50482 PA / Raw --> Other TCP Traffic
Ether / IP / TCP 192.168.1.43:50482 > 20.42.73.26:https A --> Web Traffic
Ether / IP / TCP 185.125.188.54:https > 192.168.1.43:35364 PA / Raw --> Other TCP Traffic
Ether / IP / TCP 192.168.1.43:35364 > 185.125.188.54:https A --> Web Traffic
Ether / IP / TCP 185.125.188.54:https > 192.168.1.43:35364 PA / Raw --> Other TCP Traffic
Ether / IP / TCP 185.125.188.58:https > 192.168.1.43:56312 PA / Raw --> Other TCP Traffic
Ether / IP / TCP 185.125.188.58:https > 192.168.1.43:56312 PA / Raw --> Other TCP Traffic
Ether / IP / TCP 185.125.188.54:https > 192.168.1.43:35364 PA / Raw --> Other TCP Traffic
Ether / IP / TCP 192.168.1.43:35364 > 185.125.188.54:https A --> Web Traffic
Ether / IP / TCP 192.168.1.43:56312 > 185.125.188.58:https A --> Web Traffic
Ether / IP / TCP 185.125.188.54:https > 192.168.1.43:35364 A / Raw --> Other TCP Traffic
Ether / IP / TCP 192.168.1.43:35364 > 185.125.188.54:https A --> Web Traffic
Ether / IP / TCP 185.125.188.54:https > 192.168.1.43:35364 A / Raw --> Other TCP Traffic
Ether / IP / TCP 192.168.1.43:35364 > 185.125.188.54:https A --> Web Traffic
Ether / IP / TCP 185.125.188.54:https > 192.168.1.43:35364 PA / Raw --> Other TCP Traffic
Ether / IP / TCP 185.125.188.54:https > 192.168.1.43:35364 PA / Raw --> Other TCP Traffic
Ether / IP / TCP 185.125.188.54:https > 192.168.1.43:35364 PA / Raw --> Other TCP Traffic
Ether / IP / TCP 185.125.188.54:https > 192.168.1.43:35364 PA / Raw --> Other TCP Traffic
Ether / IP / TCP 192.168.1.43:35364 > 185.125.188.54:https A --> Web Traffic
Ether / IP / TCP 192.168.1.43:35364 > 185.125.188.54:https A --> Web Traffic
Ether / IP / TCP 185.125.188.54:https > 192.168.1.43:35364 PA / Raw --> Other TCP Traffic
Ether / IP / TCP 192.168.1.43:35364 > 185.125.188.54:https A --> Web Traffic
Ether / IP / TCP 185.125.188.54:https > 192.168.1.43:35364 PA / Raw --> Other TCP Traffic
Ether / IP / TCP 192.168.1.43:35364 > 185.125.188.54:https A --> Web Traffic
Ether / IP / TCP 185.125.188.54:https > 192.168.1.43:35364 PA / Raw --> Other TCP Traffic
Ether / IP / TCP 192.168.1.43:35364 > 185.125.188.54:https A --> Web Traffic
Ether / IP / TCP 185.125.188.54:https > 192.168.1.43:35364 PA / Raw --> Other TCP Traffic
Ether / IP / TCP 192.168.1.43:35364 > 185.125.188.54:https A --> Web Traffic
Ether / IP / TCP 185.125.188.54:https > 192.168.1.43:35364 PA / Raw --> Other TCP Traffic
Ether / IP / TCP 192.168.1.43:35364 > 185.125.188.54:https A --> Web Traffic
Ether / IP / TCP 185.125.188.54:https > 192.168.1.43:35364 PA / Raw --> Other TCP Traffic
Ether / IP / TCP 192.168.1.43:35364 > 185.125.188.54:https A --> Web Traffic
Ether / 192.168.1.43 > 224.0.0.22 igmp / Raw --> Unknown Traffic
Ether / ARP who has 192.168.1.35 says 192.168.1.1 / Padding --> Unknown Traffic
Ether / ARP who has 192.168.1.43 says 192.168.1.1 / Padding --> Unknown Traffic
Ether / ARP is at 30:03:c8:8a:94:35 says 192.168.1.43 --> Unknown Traffic
Ether / ARP who has 192.168.1.34 says 192.168.1.1 / Padding --> Unknown Traffic
Ether / ARP who has 192.168.1.41 says 192.168.1.1 / Padding --> Unknown Traffic
Ether / ARP who has 192.168.1.36 says 192.168.1.1 / Padding --> Unknown Traffic
Ether / IP / TCP 192.168.1.43:50482 > 20.42.73.26:https PA / Raw --> Web Traffic
Ether / IP / TCP 192.168.1.43:50482 > 20.42.73.26:https A / Raw --> Web Traffic
Ether / IP / TCP 192.168.1.43:50482 > 20.42.73.26:https PA / Raw --> Web Traffic
Ether / IP / TCP 192.168.1.43:50482 > 20.42.73.26:https A / Raw --> Web Traffic
Ether / IP / TCP 192.168.1.43:50482 > 20.42.73.26:https PA / Raw --> Web Traffic
Ether / IP / TCP 192.168.1.43:50482 > 20.42.73.26:https A / Raw --> Web Traffic
Ether / IP / TCP 192.168.1.43:50482 > 20.42.73.26:https PA / Raw --> Web Traffic
Ether / IP / TCP 192.168.1.43:50482 > 20.42.73.26:https A / Raw --> Web Traffic
Ether / IP / TCP 192.168.1.43:50482 > 20.42.73.26:https PA / Raw --> Web Traffic
Ether / IP / TCP 192.168.1.43:50482 > 20.42.73.26:https A / Raw --> Web Traffic
Ether / IP / TCP 20.42.73.26:https > 192.168.1.43:50482 A --> Other TCP Traffic
Ether / IP / TCP 192.168.1.43:50482 > 20.42.73.26:https A / Raw --> Web Traffic
Ether / IP / TCP 192.168.1.43:50482 > 20.42.73.26:https PA / Raw --> Web Traffic
Ether / IP / TCP 192.168.1.43:50482 > 20.42.73.26:https A / Raw --> Web Traffic
Ether / IP / TCP 192.168.1.43:50482 > 20.42.73.26:https PA / Raw --> Web Traffic
Ether / IP / TCP 20.42.73.26:https > 192.168.1.43:50482 A --> Other TCP Traffic
Ether / IP / TCP 20.42.73.26:https > 192.168.1.43:50482 A --> Other TCP Traffic
Ether / IP / TCP 20.42.73.26:https > 192.168.1.43:50482 A --> Other TCP Traffic
Ether / IP / TCP 20.42.73.26:https > 192.168.1.43:50482 A --> Other TCP Traffic
Ether / IP / TCP 20.42.73.26:https > 192.168.1.43:50482 A --> Other TCP Traffic
Ether / IP / TCP 20.42.73.26:https > 192.168.1.43:50482 A --> Other TCP Traffic
Ether / IP / TCP 20.42.73.26:https > 192.168.1.43:50482 PA / Raw --> Other TCP Traffic
Ether / IP / TCP 192.168.1.43:50482 > 20.42.73.26:https A --> Web Traffic
Ether / IP / TCP 192.168.1.43:50482 > 20.42.73.26:https PA / Raw --> Web Traffic
Ether / IP / TCP 20.42.73.26:https > 192.168.1.43:50482 A --> Other TCP Traffic
Ether / IP / TCP 192.168.1.43:60546 > 172.64.155.209:https A --> Web Traffic
Ether / IP / TCP 172.64.155.209:https > 192.168.1.43:60546 A --> Other TCP Traffic
Ether / IP / TCP 192.168.1.43:50482 > 20.42.73.26:https PA / Raw --> Web Traffic
Ether / IP / TCP 192.168.1.43:50482 > 20.42.73.26:https A / Raw --> Web Traffic
Ether / IP / TCP 192.168.1.43:50482 > 20.42.73.26:https PA / Raw --> Web Traffic
Ether / IP / TCP 192.168.1.43:50482 > 20.42.73.26:https A / Raw --> Web Traffic
Ether / IP / TCP 192.168.1.43:50482 > 20.42.73.26:https PA / Raw --> Web Traffic
Ether / IP / TCP 192.168.1.43:50482 > 20.42.73.26:https A / Raw --> Web Traffic
Ether / IP / TCP 192.168.1.43:50482 > 20.42.73.26:https PA / Raw --> Web Traffic
Ether / IP / TCP 192.168.1.43:50482 > 20.42.73.26:https A / Raw --> Web Traffic
Ether / IP / TCP 192.168.1.43:50482 > 20.42.73.26:https PA / Raw --> Web Traffic
Ether / IP / TCP 192.168.1.43:50482 > 20.42.73.26:https PA / Raw --> Web Traffic
Ether / IP / TCP 20.42.73.26:https > 192.168.1.43:50482 A --> Other TCP Traffic
Ether / IP / TCP 20.42.73.26:https > 192.168.1.43:50482 A --> Other TCP Traffic
Ether / IP / TCP 20.42.73.26:https > 192.168.1.43:50482 A --> Other TCP Traffic
Ether / IP / TCP 20.42.73.26:https > 192.168.1.43:50482 A --> Other TCP Traffic
Ether / IP / TCP 20.42.73.26:https > 192.168.1.43:50482 PA / Raw --> Other TCP Traffic
Ether / IP / TCP 192.168.1.43:50482 > 20.42.73.26:https A --> Web Traffic
Ether / IP / TCP 20.42.73.26:https > 192.168.1.43:50482 A --> Other TCP Traffic
Ether / IP / TCP 185.125.188.54:https > 192.168.1.43:35364 PA / Raw --> Other TCP Traffic
Ether / IP / TCP 192.168.1.43:35364 > 185.125.188.54:https A --> Web Traffic
Ether / IP / TCP 185.125.188.54:https > 192.168.1.43:35364 FA --> Other TCP Traffic
Ether / IP / TCP 192.168.1.43:35364 > 185.125.188.54:https PA / Raw --> Web Traffic
Ether / IP / TCP 192.168.1.43:35364 > 185.125.188.54:https FA --> Web Traffic
Ether / ARP who has 192.168.1.35 says 192.168.1.1 / Padding --> Unknown Traffic
Ether / ARP who has 192.168.1.43 says 192.168.1.1 / Padding --> Unknown Traffic
Ether / ARP is at 30:03:c8:8a:94:35 says 192.168.1.43 --> Unknown Traffic
Ether / IP / TCP 185.125.188.58:https > 192.168.1.43:56312 PA / Raw --> Other TCP Traffic
Ether / IP / TCP 185.125.188.58:https > 192.168.1.43:56312 FPA / Raw --> Other TCP Traffic
Ether / IP / TCP 185.125.188.54:https > 192.168.1.43:35364 R --> Other TCP Traffic
Ether / IP / TCP 192.168.1.43:56312 > 185.125.188.58:https A --> Web Traffic
Ether / IP / TCP 192.168.1.43:56312 > 185.125.188.58:https PA / Raw --> Web Traffic
Ether / IP / TCP 192.168.1.43:56312 > 185.125.188.58:https FA --> Web Traffic
Ether / ARP who has 192.168.1.34 says 192.168.1.1 / Padding --> Unknown Traffic
Ether / ARP who has 192.168.1.41 says 192.168.1.1 / Padding --> Unknown Traffic
Ether / IP / TCP 185.125.188.58:https > 192.168.1.43:56312 R --> Other TCP Traffic
Ether / IP / TCP 185.125.188.58:https > 192.168.1.43:56312 R --> Other TCP Traffic
Ether / IP / TCP 192.168.1.43:50482 > 20.42.73.26:https PA / Raw --> Web Traffic
Ether / IP / TCP 192.168.1.43:50482 > 20.42.73.26:https A / Raw --> Web Traffic
Ether / IP / TCP 192.168.1.43:50482 > 20.42.73.26:https PA / Raw --> Web Traffic
Ether / IP / TCP 192.168.1.43:50482 > 20.42.73.26:https A / Raw --> Web Traffic
Ether / IP / TCP 192.168.1.43:50482 > 20.42.73.26:https PA / Raw --> Web Traffic
Ether / IP / TCP 192.168.1.43:50482 > 20.42.73.26:https A / Raw --> Web Traffic
Ether / IP / TCP 192.168.1.43:50482 > 20.42.73.26:https PA / Raw --> Web Traffic
Ether / IP / TCP 192.168.1.43:50482 > 20.42.73.26:https A / Raw --> Web Traffic
Ether / IP / TCP 192.168.1.43:50482 > 20.42.73.26:https PA / Raw --> Web Traffic
Ether / IP / TCP 192.168.1.43:50482 > 20.42.73.26:https A / Raw --> Web Traffic
Ether / IP / TCP 20.42.73.26:https > 192.168.1.43:50482 A --> Other TCP Traffic
Ether / IP / TCP 192.168.1.43:50482 > 20.42.73.26:https PA / Raw --> Web Traffic
Ether / IP / TCP 20.42.73.26:https > 192.168.1.43:50482 A --> Other TCP Traffic
Ether / IP / TCP 20.42.73.26:https > 192.168.1.43:50482 A --> Other TCP Traffic
Ether / IP / TCP 20.42.73.26:https > 192.168.1.43:50482 A --> Other TCP Traffic
Ether / IP / TCP 20.42.73.26:https > 192.168.1.43:50482 A --> Other TCP Traffic
Ether / IP / TCP 20.42.73.26:https > 192.168.1.43:50482 PA / Raw --> Other TCP Traffic
Ether / IP / TCP 192.168.1.43:50482 > 20.42.73.26:https A --> Web Traffic
Ether / IP / TCP 192.168.1.43:50482 > 20.42.73.26:https PA / Raw --> Web Traffic
Ether / IP / TCP 192.168.1.43:50482 > 20.42.73.26:https A / Raw --> Web Traffic
Ether / IP / TCP 192.168.1.43:50482 > 20.42.73.26:https PA / Raw --> Web Traffic
Ether / IP / TCP 192.168.1.43:50482 > 20.42.73.26:https A / Raw --> Web Traffic
Ether / IP / TCP 192.168.1.43:50482 > 20.42.73.26:https PA / Raw --> Web Traffic
Ether / IP / TCP 192.168.1.43:50482 > 20.42.73.26:https PA / Raw --> Web Traffic
Ether / ARP who has 192.168.1.35 says 192.168.1.1 / Padding --> Unknown Traffic
Ether / ARP who has 192.168.1.43 says 192.168.1.1 / Padding --> Unknown Traffic
Ether / ARP is at 30:03:c8:8a:94:35 says 192.168.1.43 --> Unknown Traffic
Ether / ARP who has 192.168.1.34 says 192.168.1.1 / Padding --> Unknown Traffic
Ether / ARP who has 192.168.1.41 says 192.168.1.1 / Padding --> Unknown Traffic
Ether / IP / TCP 20.42.73.26:https > 192.168.1.43:50482 PA / Raw --> Other TCP Traffic
Ether / IP / TCP 192.168.1.43:50482 > 20.42.73.26:https A --> Web Traffic
Ether / IP / TCP 20.42.73.26:https > 192.168.1.43:50482 A --> Other TCP Traffic
Ether / IP / TCP 192.168.1.43:50482 > 20.42.73.26:https A --> Web Traffic
Ether / IP / TCP 20.42.73.26:https > 192.168.1.43:50482 A --> Other TCP Traffic
Ether / IP / TCP 20.42.73.26:https > 192.168.1.43:50482 A --> Other TCP Traffic
Ether / IP / TCP 192.168.1.43:50482 > 20.42.73.26:https PA / Raw --> Web Traffic
Ether / IP / TCP 20.42.73.26:https > 192.168.1.43:50482 A --> Other TCP Traffic
Ether / IP / TCP 192.168.1.43:50482 > 20.42.73.26:https PA / Raw --> Web Traffic
Ether / IP / TCP 192.168.1.43:50482 > 20.42.73.26:https A / Raw --> Web Traffic
Ether / IP / TCP 192.168.1.43:50482 > 20.42.73.26:https PA / Raw --> Web Traffic
Ether / IP / TCP 192.168.1.43:50482 > 20.42.73.26:https A / Raw --> Web Traffic
Ether / IP / TCP 192.168.1.43:50482 > 20.42.73.26:https PA / Raw --> Web Traffic
Ether / IP / TCP 192.168.1.43:50482 > 20.42.73.26:https PA / Raw --> Web Traffic
Ether / IP / TCP 20.42.73.26:https > 192.168.1.43:50482 A --> Other TCP Traffic
Ether / IP / TCP 20.42.73.26:https > 192.168.1.43:50482 A --> Other TCP Traffic
Ether / IP / TCP 20.42.73.26:https > 192.168.1.43:50482 A --> Other TCP Traffic
Ether / IP / TCP 20.42.73.26:https > 192.168.1.43:50482 PA / Raw --> Other TCP Traffic
Ether / IP / TCP 192.168.1.43:50482 > 20.42.73.26:https A --> Web Traffic
Ether / ARP who has 192.168.1.35 says 192.168.1.1 / Padding --> Unknown Traffic
Ether / ARP who has 192.168.1.43 says 192.168.1.1 / Padding --> Unknown Traffic
Ether / ARP is at 30:03:c8:8a:94:35 says 192.168.1.43 --> Unknown Traffic
Ether / ARP who has 192.168.1.34 says 192.168.1.1 / Padding --> Unknown Traffic
Ether / ARP who has 192.168.1.41 says 192.168.1.1 / Padding --> Unknown Traffic
Ether / IP / TCP 192.168.1.43:39578 > 140.82.113.25:https A --> Web Traffic
Ether / IP / TCP 192.168.1.43:35134 > 13.67.9.5:https A --> Web Traffic
Ether / IP / TCP 13.67.9.5:https > 192.168.1.43:35134 A --> Other TCP Traffic
Ether / IP / TCP 140.82.113.25:https > 192.168.1.43:39578 A --> Other TCP Traffic
Ether / IP / TCP 192.168.1.43:50482 > 20.42.73.26:https PA / Raw --> Web Traffic
Ether / IP / TCP 192.168.1.43:50482 > 20.42.73.26:https A / Raw --> Web Traffic
Ether / IP / TCP 192.168.1.43:50482 > 20.42.73.26:https PA / Raw --> Web Traffic
Ether / IP / TCP 192.168.1.43:50482 > 20.42.73.26:https A / Raw --> Web Traffic
Ether / IP / TCP 192.168.1.43:50482 > 20.42.73.26:https PA / Raw --> Web Traffic
Ether / IP / TCP 192.168.1.43:50482 > 20.42.73.26:https A / Raw --> Web Traffic
Ether / IP / TCP 192.168.1.43:50482 > 20.42.73.26:https PA / Raw --> Web Traffic
Ether / IP / TCP 192.168.1.43:50482 > 20.42.73.26:https A / Raw --> Web Traffic
Ether / IP / TCP 192.168.1.43:50482 > 20.42.73.26:https PA / Raw --> Web Traffic
Ether / IP / TCP 192.168.1.43:50482 > 20.42.73.26:https A / Raw --> Web Traffic
Ether / IP / TCP 20.42.73.26:https > 192.168.1.43:50482 A --> Other TCP Traffic
Ether / IP / TCP 192.168.1.43:50482 > 20.42.73.26:https PA / Raw --> Web Traffic
Ether / IP / TCP 20.42.73.26:https > 192.168.1.43:50482 A --> Other TCP Traffic
Ether / IP / TCP 20.42.73.26:https > 192.168.1.43:50482 A --> Other TCP Traffic
Ether / IP / TCP 20.42.73.26:https > 192.168.1.43:50482 A --> Other TCP Traffic
Ether / IP / TCP 20.42.73.26:https > 192.168.1.43:50482 A --> Other TCP Traffic
Ether / IP / TCP 20.42.73.26:https > 192.168.1.43:50482 PA / Raw --> Other TCP Traffic
Ether / IP / TCP 192.168.1.43:50482 > 20.42.73.26:https A --> Web Traffic
Ether / IP / TCP 20.42.73.26:https > 192.168.1.43:50482 PA / Raw --> Other TCP Traffic
Ether / IP / TCP 192.168.1.43:50482 > 20.42.73.26:https A --> Web Traffic
Ether / ARP who has 192.168.1.35 says 192.168.1.1 / Padding --> Unknown Traffic
Ether / ARP who has 192.168.1.43 says 192.168.1.1 / Padding --> Unknown Traffic
Ether / ARP is at 30:03:c8:8a:94:35 says 192.168.1.43 --> Unknown Traffic
Ether / ARP who has 192.168.1.34 says 192.168.1.1 / Padding --> Unknown Traffic
Ether / ARP who has 192.168.1.41 says 192.168.1.1 / Padding --> Unknown Traffic
Ether / IP / TCP 192.168.1.43:35134 > 13.67.9.5:https PA / Raw --> Web Traffic
Ether / IP / UDP / DNS Qry b'vscode-sync.trafficmanager.net.' --> DNS Traffic
Ether / IP / UDP / DNS Qry b'vscode-sync.trafficmanager.net.' --> DNS Traffic
Ether / IP / UDP / DNS Ans b'vscode-sync-ase-01.azurewebsites.net.' --> Other UDP Traffic
Ether / IP / UDP / DNS Ans b'vscode-sync-ase-01.azurewebsites.net.' --> Other UDP Traffic
Ether / IP / UDP / DNS Qry b'waws-prod-sg1-051.southeastasia.cloudapp.azure.com.' --> DNS Traffic
Ether / IP / UDP / DNS Ans --> Other UDP Traffic
Ether / IP / TCP 13.67.9.5:https > 192.168.1.43:35134 PA / Raw --> Other TCP Traffic
Ether / IP / TCP 192.168.1.43:35134 > 13.67.9.5:https A --> Web Traffic
Ether / IP / TCP 192.168.1.43:50482 > 20.42.73.26:https PA / Raw --> Web Traffic
Ether / IP / TCP 192.168.1.43:50482 > 20.42.73.26:https A / Raw --> Web Traffic
Ether / IP / TCP 192.168.1.43:50482 > 20.42.73.26:https PA / Raw --> Web Traffic
Ether / IP / TCP 192.168.1.43:50482 > 20.42.73.26:https A / Raw --> Web Traffic
Ether / IP / TCP 192.168.1.43:50482 > 20.42.73.26:https PA / Raw --> Web Traffic
Ether / IP / TCP 192.168.1.43:50482 > 20.42.73.26:https A / Raw --> Web Traffic
Ether / IP / TCP 192.168.1.43:50482 > 20.42.73.26:https PA / Raw --> Web Traffic
Ether / IP / TCP 192.168.1.43:50482 > 20.42.73.26:https A / Raw --> Web Traffic
Ether / IP / TCP 192.168.1.43:50482 > 20.42.73.26:https PA / Raw --> Web Traffic
Ether / IP / TCP 192.168.1.43:50482 > 20.42.73.26:https A / Raw --> Web Traffic
Ether / IP / TCP 20.42.73.26:https > 192.168.1.43:50482 A --> Other TCP Traffic
Ether / IP / TCP 192.168.1.43:50482 > 20.42.73.26:https PA / Raw --> Web Traffic
Ether / IP / TCP 20.42.73.26:https > 192.168.1.43:50482 A --> Other TCP Traffic
Ether / IP / TCP 20.42.73.26:https > 192.168.1.43:50482 A --> Other TCP Traffic
Ether / IP / TCP 20.42.73.26:https > 192.168.1.43:50482 A --> Other TCP Traffic
Ether / IP / TCP 20.42.73.26:https > 192.168.1.43:50482 PA / Raw --> Other TCP Traffic
Ether / IP / TCP 192.168.1.43:50482 > 20.42.73.26:https A --> Web Traffic
Ether / IP / TCP 192.168.1.43:50482 > 20.42.73.26:https PA / Raw --> Web Traffic
Ether / IP / TCP 20.42.73.26:https > 192.168.1.43:50482 A --> Other TCP Traffic
Ether / IP / TCP 157.240.16.52:https > 192.168.1.43:40084 PA / Raw --> Other TCP Traffic
Ether / IP / TCP 192.168.1.43:40084 > 157.240.16.52:https A --> Web Traffic
Ether / IP / TCP 192.168.1.43:40084 > 157.240.16.52:https PA / Raw --> Web Traffic
Ether / IP / TCP 192.168.1.43:40084 > 157.240.16.52:https PA / Raw --> Web Traffic
Ether / IP / TCP 157.240.16.52:https > 192.168.1.43:40084 A --> Other TCP Traffic
Ether / IP / TCP 157.240.16.52:https > 192.168.1.43:40084 A --> Other TCP Traffic
Ether / IP / UDP / DNS Qry b'mobile.events.data.microsoft.com.' --> DNS Traffic
Ether / IP / TCP 192.168.1.43:50482 > 20.42.73.26:https PA / Raw --> Web Traffic
Ether / IP / TCP 192.168.1.43:50482 > 20.42.73.26:https A / Raw --> Web Traffic
Ether / IP / TCP 192.168.1.43:50482 > 20.42.73.26:https PA / Raw --> Web Traffic
Ether / IP / UDP / DNS Qry b'mobile.events.data.microsoft.com.' --> DNS Traffic
Ether / IP / TCP 192.168.1.43:50482 > 20.42.73.26:https A / Raw --> Web Traffic
Ether / IP / TCP 192.168.1.43:50482 > 20.42.73.26:https PA / Raw --> Web Traffic
Ether / IP / TCP 192.168.1.43:50482 > 20.42.73.26:https A / Raw --> Web Traffic
Ether / IP / TCP 192.168.1.43:50482 > 20.42.73.26:https PA / Raw --> Web Traffic
Ether / IP / TCP 192.168.1.43:50482 > 20.42.73.26:https A / Raw --> Web Traffic
Ether / IP / TCP 192.168.1.43:50482 > 20.42.73.26:https PA / Raw --> Web Traffic
Ether / IP / TCP 192.168.1.43:50482 > 20.42.73.26:https PA / Raw --> Web Traffic
Ether / IP / UDP / DNS Ans b'mobile.events.data.trafficmanager.net.' --> Other UDP Traffic
Ether / IP / UDP / DNS Ans b'mobile.events.data.trafficmanager.net.' --> Other UDP Traffic
Ether / IP / UDP / DNS Qry b'onedscolprdgwc03.germanywestcentral.cloudapp.azure.com.' --> DNS Traffic
Ether / IP / UDP / DNS Ans --> Other UDP Traffic
Ether / IP / TCP 20.42.73.26:https > 192.168.1.43:50482 A --> Other TCP Traffic
Ether / IP / TCP 20.42.73.26:https > 192.168.1.43:50482 A --> Other TCP Traffic
Ether / IP / TCP 20.42.73.26:https > 192.168.1.43:50482 A --> Other TCP Traffic
Ether / IP / TCP 20.42.73.26:https > 192.168.1.43:50482 A --> Other TCP Traffic
Ether / IP / TCP 20.42.73.26:https > 192.168.1.43:50482 A --> Other TCP Traffic
Ether / IP / TCP 20.42.73.26:https > 192.168.1.43:50482 PA / Raw --> Other TCP Traffic
Ether / IP / TCP 192.168.1.43:50482 > 20.42.73.26:https A --> Web Traffic
Ether / ARP who has 192.168.1.35 says 192.168.1.1 / Padding --> Unknown Traffic
Ether / ARP who has 192.168.1.43 says 192.168.1.1 / Padding --> Unknown Traffic
Ether / ARP is at 30:03:c8:8a:94:35 says 192.168.1.43 --> Unknown Traffic
Ether / ARP who has 192.168.1.34 says 192.168.1.1 / Padding --> Unknown Traffic
Ether / ARP who has 192.168.1.41 says 192.168.1.1 / Padding --> Unknown Traffic
Ether / IP / TCP 192.168.1.43:50482 > 20.42.73.26:https PA / Raw --> Web Traffic
Ether / IP / TCP 192.168.1.43:50482 > 20.42.73.26:https A / Raw --> Web Traffic
Ether / IP / TCP 192.168.1.43:50482 > 20.42.73.26:https PA / Raw --> Web Traffic
Ether / IP / TCP 192.168.1.43:50482 > 20.42.73.26:https A / Raw --> Web Traffic
Ether / IP / TCP 192.168.1.43:50482 > 20.42.73.26:https PA / Raw --> Web Traffic
Ether / IP / TCP 192.168.1.43:50482 > 20.42.73.26:https PA / Raw --> Web Traffic
Ether / IP / TCP 20.42.73.26:https > 192.168.1.43:50482 A --> Other TCP Traffic
Ether / IP / TCP 20.42.73.26:https > 192.168.1.43:50482 A --> Other TCP Traffic
Ether / IP / TCP 20.42.73.26:https > 192.168.1.43:50482 A --> Other TCP Traffic
Ether / IP / TCP 20.42.73.26:https > 192.168.1.43:50482 PA / Raw --> Other TCP Traffic
Ether / IP / TCP 192.168.1.43:50482 > 20.42.73.26:https A --> Web Traffic
Ether / ARP who has 192.168.1.35 says 192.168.1.1 / Padding --> Unknown Traffic
Ether / ARP who has 192.168.1.43 says 192.168.1.1 / Padding --> Unknown Traffic
Ether / ARP is at 30:03:c8:8a:94:35 says 192.168.1.43 --> Unknown Traffic
Ether / ARP who has 192.168.1.34 says 192.168.1.1 / Padding --> Unknown Traffic
Ether / ARP who has 192.168.1.41 says 192.168.1.1 / Padding --> Unknown Traffic
Ether / IP / TCP 192.168.1.43:50482 > 20.42.73.26:https PA / Raw --> Web Traffic
Ether / IP / TCP 192.168.1.43:50482 > 20.42.73.26:https A / Raw --> Web Traffic
Ether / IP / TCP 192.168.1.43:50482 > 20.42.73.26:https PA / Raw --> Web Traffic
Ether / IP / TCP 192.168.1.43:50482 > 20.42.73.26:https A / Raw --> Web Traffic
Ether / IP / TCP 192.168.1.43:50482 > 20.42.73.26:https PA / Raw --> Web Traffic
Ether / IP / TCP 20.42.73.26:https > 192.168.1.43:50482 A --> Other TCP Traffic
Ether / IP / TCP 20.42.73.26:https > 192.168.1.43:50482 A --> Other TCP Traffic
Ether / IP / TCP 20.42.73.26:https > 192.168.1.43:50482 PA / Raw --> Other TCP Traffic
Ether / IP / TCP 192.168.1.43:50482 > 20.42.73.26:https A --> Web Traffic
Ether / IP / TCP 192.168.1.43:50482 > 20.42.73.26:https PA / Raw --> Web Traffic
Ether / IP / TCP 20.42.73.26:https > 192.168.1.43:50482 A --> Other TCP Traffic
Ether / ARP who has 192.168.1.35 says 192.168.1.1 / Padding --> Unknown Traffic
Ether / ARP who has 192.168.1.43 says 192.168.1.1 / Padding --> Unknown Traffic
Ether / ARP is at 30:03:c8:8a:94:35 says 192.168.1.43 --> Unknown Traffic
Ether / ARP who has 192.168.1.34 says 192.168.1.1 / Padding --> Unknown Traffic
Ether / ARP who has 192.168.1.41 says 192.168.1.1 / Padding --> Unknown Traffic
Ether / IP / TCP 192.168.1.43:50482 > 20.42.73.26:https PA / Raw --> Web Traffic
Ether / IP / TCP 192.168.1.43:50482 > 20.42.73.26:https A / Raw --> Web Traffic
Ether / IP / TCP 192.168.1.43:50482 > 20.42.73.26:https PA / Raw --> Web Traffic
Ether / IP / TCP 192.168.1.43:50482 > 20.42.73.26:https A / Raw --> Web Traffic
Ether / IP / TCP 192.168.1.43:50482 > 20.42.73.26:https PA / Raw --> Web Traffic
Ether / IP / TCP 192.168.1.43:50482 > 20.42.73.26:https PA / Raw --> Web Traffic
Ether / IP / TCP 192.168.1.43:52084 > 104.18.32.47:https A --> Web Traffic
Ether / IP / TCP 20.42.73.26:https > 192.168.1.43:50482 A --> Other TCP Traffic
Ether / IP / TCP 20.42.73.26:https > 192.168.1.43:50482 A --> Other TCP Traffic
Ether / IP / TCP 20.42.73.26:https > 192.168.1.43:50482 A --> Other TCP Traffic
Ether / IP / TCP 20.42.73.26:https > 192.168.1.43:50482 PA / Raw --> Other TCP Traffic
Ether / IP / TCP 104.18.32.47:https > 192.168.1.43:52084 A --> Other TCP Traffic
Ether / IP / TCP 192.168.1.43:50482 > 20.42.73.26:https A --> Web Traffic
Ether / IP / TCP 140.82.113.25:https > 192.168.1.43:39578 PA / Raw --> Other TCP Traffic
Ether / IP / TCP 192.168.1.43:39578 > 140.82.113.25:https PA / Raw --> Web Traffic
Ether / IP / TCP 140.82.113.25:https > 192.168.1.43:39578 A --> Other TCP Traffic
Ether / ARP who has 192.168.1.35 says 192.168.1.1 / Padding --> Unknown Traffic
Ether / ARP who has 192.168.1.43 says 192.168.1.1 / Padding --> Unknown Traffic
Ether / ARP is at 30:03:c8:8a:94:35 says 192.168.1.43 --> Unknown Traffic
Ether / ARP who has 192.168.1.34 says 192.168.1.1 / Padding --> Unknown Traffic
Ether / ARP who has 192.168.1.41 says 192.168.1.1 / Padding --> Unknown Traffic
Ether / IP / TCP 192.168.1.43:50482 > 20.42.73.26:https PA / Raw --> Web Traffic
Ether / IP / TCP 192.168.1.43:50482 > 20.42.73.26:https A / Raw --> Web Traffic
Ether / IP / TCP 192.168.1.43:50482 > 20.42.73.26:https PA / Raw --> Web Traffic
Ether / IP / TCP 192.168.1.43:50482 > 20.42.73.26:https A / Raw --> Web Traffic
Ether / IP / TCP 192.168.1.43:50482 > 20.42.73.26:https PA / Raw --> Web Traffic
Ether / IP / TCP 192.168.1.43:50482 > 20.42.73.26:https PA / Raw --> Web Traffic
Ether / IP / TCP 20.42.73.26:https > 192.168.1.43:50482 A --> Other TCP Traffic
Ether / IP / TCP 20.42.73.26:https > 192.168.1.43:50482 A --> Other TCP Traffic
Ether / IP / TCP 20.42.73.26:https > 192.168.1.43:50482 A --> Other TCP Traffic
Ether / IP / TCP 20.42.73.26:https > 192.168.1.43:50482 PA / Raw --> Other TCP Traffic
Ether / IP / TCP 192.168.1.43:50482 > 20.42.73.26:https A --> Web Traffic
Ether / IP / TCP 192.168.1.43:50482 > 20.42.73.26:https PA / Raw --> Web Traffic
Ether / IP / TCP 20.42.73.26:https > 192.168.1.43:50482 A --> Other TCP Traffic
Ether / IP / TCP 140.82.113.25:https > 192.168.1.43:39578 PA / Raw --> Other TCP Traffic
Ether / IP / TCP 140.82.113.25:https > 192.168.1.43:39578 FA --> Other TCP Traffic
Ether / IP / TCP 192.168.1.43:39578 > 140.82.113.25:https FA --> Web Traffic
Ether / IP / UDP / DNS Qry b'alive.github.com.' --> DNS Traffic
Ether / IP / UDP / DNS Qry b'alive.github.com.' --> DNS Traffic
Ether / IP / UDP / DNS Ans b'live.github.com.' --> Other UDP Traffic
Ether / IP / UDP / DNS Ans b'live.github.com.' --> Other UDP Traffic
Ether / IP / UDP / DNS Qry b'live.github.com.' --> DNS Traffic
Ether / IP / UDP / DNS Ans --> Other UDP Traffic
Ether / IP / TCP 192.168.1.43:54596 > 140.82.112.25:https S --> Web Traffic
Ether / IP / TCP 140.82.113.25:https > 192.168.1.43:39578 A --> Other TCP Traffic
Ether / IP / TCP 140.82.112.25:https > 192.168.1.43:54596 SA --> Other TCP Traffic
Ether / IP / TCP 192.168.1.43:54596 > 140.82.112.25:https A --> Web Traffic
Ether / IP / TCP 192.168.1.43:54596 > 140.82.112.25:https A / Raw --> Web Traffic
Ether / IP / TCP 192.168.1.43:54596 > 140.82.112.25:https PA / Raw --> Web Traffic
Ether / IP / TCP 140.82.112.25:https > 192.168.1.43:54596 A --> Other TCP Traffic
Ether / IP / TCP 140.82.112.25:https > 192.168.1.43:54596 PA / Raw --> Other TCP Traffic
Ether / IP / TCP 192.168.1.43:54596 > 140.82.112.25:https A --> Web Traffic
Ether / IP / TCP 140.82.112.25:https > 192.168.1.43:54596 PA / Raw --> Other TCP Traffic
Ether / IP / TCP 192.168.1.43:54596 > 140.82.112.25:https A --> Web Traffic
Ether / IP / TCP 192.168.1.43:54596 > 140.82.112.25:https PA / Raw --> Web Traffic
Ether / IP / TCP 192.168.1.43:54596 > 140.82.112.25:https PA / Raw --> Web Traffic
Ether / IP / TCP 140.82.112.25:https > 192.168.1.43:54596 PA / Raw --> Other TCP Traffic
Ether / IP / TCP 140.82.112.25:https > 192.168.1.43:54596 PA / Raw --> Other TCP Traffic
Ether / IP / TCP 140.82.112.25:https > 192.168.1.43:54596 PA / Raw --> Other TCP Traffic
Ether / IP / TCP 192.168.1.43:54596 > 140.82.112.25:https A --> Web Traffic
